{
  "$schema": "../contracts/governance/organization.schema.json",
  "version": 9,
  "runtime": {
    "maxWriterLanes": 3,
    "maxSpawnDepth": 1,
    "maxSameCauseAttempts": 2,
    "maxReviewFixCycles": 2,
    "maxCapsuleTokens": 1500,
    "claimTtlMinutes": 120,
    "leaseTtlMinutes": 30,
    "heartbeatMinutes": 5,
    "maxLeaseRenewals": 3,
    "maxSameCauseHandoffs": 2
  },
  "controlPlane": {
    "dispatcherMode": "single-writer",
    "bootstrapState": "git-common-dir",
    "multiMachineReady": false,
    "exclusiveResourceClasses": [
      "agent-organization-registry",
      "public-contract",
      "database-migration",
      "dependency-lockfile",
      "drupal-config",
      "ai-source-registry",
      "ai-knowledge-release-registry",
      "ai-dataset-registry"
    ],
    "sharedPathResources": [
      {
        "path": "package-lock.json",
        "resource": "dependency-lockfile"
      },
      {
        "path": "backend/api/prisma/migrations",
        "resource": "database-migration"
      },
      {
        "path": "backend/ai/migrations",
        "resource": "database-migration"
      },
      {
        "path": "backend/ai/pyproject.toml",
        "resource": "dependency-lockfile"
      },
      {
        "path": "backend/ai/uv.lock",
        "resource": "dependency-lockfile"
      },
      {
        "path": "contracts/openapi",
        "resource": "public-contract"
      },
      {
        "path": "contracts/asyncapi",
        "resource": "public-contract"
      },
      {
        "path": "packages/api-client/src/generated.ts",
        "resource": "public-contract"
      },
      {
        "path": "drupal/config",
        "resource": "drupal-config"
      },
      {
        "path": "drupal/recipes",
        "resource": "drupal-config"
      },
      {
        "path": "backend/ai/dataset-specs",
        "resource": "ai-source-registry"
      },
      {
        "path": ".agents/organization.json",
        "resource": "agent-organization-registry"
      }
    ]
  },
  "humanAuthorities": [
    "executive-sponsor",
    "product-owner",
    "product-manager",
    "business-owner",
    "design-lead",
    "identity-platform-owner",
    "architect",
    "security-owner",
    "privacy-owner",
    "legal-owner",
    "data-owner",
    "engineering-lead",
    "release-owner"
  ],
  "supportingHumanRoles": [
    "product-analyst",
    "business-analyst",
    "data-steward",
    "quality-lead"
  ],
  "roles": [
    {
      "id": "orchestrator",
      "description": "Own one work item, route bounded context and coordinate direct specialists without implementing approval decisions.",
      "mode": "read-only",
      "authority": "coordination",
      "capabilities": ["read", "search", "shell"],
      "maxTurns": 24,
      "trigger": ["controlled", "parallel", "cross-system"]
    },
    {
      "id": "explorer",
      "description": "Perform bounded read-heavy repository or documentation research and return a concise evidence summary.",
      "mode": "read-only",
      "authority": "advisory",
      "capabilities": ["read", "search", "shell"],
      "maxTurns": 18,
      "trigger": ["discovery", "research", "noisy-analysis"]
    },
    {
      "id": "implementer",
      "description": "Implement one approved outcome inside declared paths and return observed evidence.",
      "mode": "scoped-write",
      "authority": "implementation",
      "capabilities": ["read", "search", "write", "shell"],
      "maxTurns": 30,
      "trigger": ["fast", "bounded", "controlled", "parallel"]
    },
    {
      "id": "reviewer-verifier",
      "description": "Verify acceptance and review correctness, regression and maintainability without editing.",
      "mode": "read-only",
      "authority": "evidence",
      "capabilities": ["read", "search", "shell"],
      "maxTurns": 20,
      "trigger": ["behavior-change", "bounded-review", "controlled-review"]
    },
    {
      "id": "risk-reviewer",
      "description": "Review security, privacy, data, AI, contracts, rights and operations without accepting risk.",
      "mode": "read-only",
      "authority": "advisory",
      "capabilities": ["read", "search", "shell"],
      "maxTurns": 20,
      "trigger": ["controlled"]
    },
    {
      "id": "integrator",
      "description": "Integrate sealed disjoint lanes, resolve mechanical conflicts and run cross-lane checks without approving release.",
      "mode": "scoped-write",
      "authority": "integration",
      "capabilities": ["read", "search", "write", "shell"],
      "maxTurns": 24,
      "trigger": ["parallel", "integration"]
    },
    {
      "id": "dataset-source-researcher",
      "description": "Research dataset and source candidates read-only, record provenance and license evidence, and never download or accept rights.",
      "mode": "read-only",
      "authority": "advisory",
      "capabilities": ["read", "search", "shell"],
      "maxTurns": 18,
      "trigger": ["dataset-source"]
    },
    {
      "id": "synthetic-dataset-builder",
      "description": "Generate one schema-valid synthetic candidate shard from approved inputs without production PII or release authority.",
      "mode": "scoped-write",
      "authority": "implementation",
      "capabilities": ["read", "search", "write", "shell"],
      "maxTurns": 30,
      "trigger": ["synthetic-dataset"]
    },
    {
      "id": "dataset-quality-reviewer",
      "description": "Independently verify dataset schema, grounding, duplication, contamination, PII, bias and coverage without editing or releasing it.",
      "mode": "read-only",
      "authority": "evidence",
      "capabilities": ["read", "search", "shell"],
      "maxTurns": 24,
      "trigger": ["dataset-release", "synthetic-dataset-review"]
    }
  ],
  "workspaces": [
    {
      "id": "root",
      "path": ".",
      "owns": ["cross-system-governance", "product-policy", "contracts"]
    },
    {
      "id": "drupal",
      "path": "drupal",
      "owns": ["public-ssr", "cms", "seo", "editorial-experience"]
    },
    {
      "id": "api",
      "path": "backend/api",
      "owns": ["public-api", "authorization", "transactions", "integrations"]
    },
    {
      "id": "ai",
      "path": "backend/ai",
      "owns": ["model-policy", "retrieval", "evaluation", "ai-tools"]
    },
    {
      "id": "mobile",
      "path": "mobile",
      "owns": ["react-native", "native-auth", "offline-client"]
    },
    {
      "id": "customer-portal",
      "path": "apps/customer-portal",
      "owns": ["authenticated-customer-web"]
    },
    {
      "id": "workforce-portal",
      "path": "apps/workforce-portal",
      "owns": ["workforce-administration", "workforce-experience"]
    },
    {
      "id": "identity-theme",
      "path": "apps/identity-theme",
      "owns": [
        "keycloak-login-theme",
        "keycloak-email-theme",
        "identity-experience"
      ]
    },
    {
      "id": "design-tokens",
      "path": "packages/design-tokens",
      "owns": ["cross-experience-design-tokens"]
    },
    {
      "id": "infra",
      "path": "infra",
      "owns": ["environments", "delivery", "observability", "recovery"]
    }
  ],
  "departments": [
    {
      "id": "product-delivery",
      "name": "Product & Delivery",
      "leadHumanRole": "product-manager",
      "mandate": "Shape product outcomes, requirements, portfolio, sequencing and delivery evidence.",
      "workspaces": ["root"]
    },
    {
      "id": "architecture-risk",
      "name": "Architecture & Risk",
      "leadHumanRole": "architect",
      "mandate": "Own system boundaries and route security, privacy, legal and data decisions to named human authorities.",
      "workspaces": ["root"]
    },
    {
      "id": "engineering-enablement",
      "name": "Engineering Enablement",
      "leadHumanRole": "engineering-lead",
      "mandate": "Own repository standards, agent control plane, developer workflows and cross-provider validation.",
      "workspaces": ["root"]
    },
    {
      "id": "digital-platform",
      "name": "Digital Platform",
      "leadHumanRole": "engineering-lead",
      "mandate": "Own the public API, authorization, transactional business state and external integration orchestration.",
      "workspaces": ["api"]
    },
    {
      "id": "ai-data",
      "name": "AI & Data",
      "leadHumanRole": "data-owner",
      "mandate": "Own governed knowledge, retrieval, inference policy, tool proposals, evaluation and AI release evidence.",
      "workspaces": ["ai"]
    },
    {
      "id": "web-experience",
      "name": "Web Experience",
      "leadHumanRole": "design-lead",
      "mandate": "Own public SSR, CMS, SEO, editorial experience, accessibility and web presentation.",
      "workspaces": ["drupal"]
    },
    {
      "id": "client-experience",
      "name": "Client Experience",
      "leadHumanRole": "engineering-lead",
      "mandate": "Own authenticated customer web and native client experiences without duplicating server authority.",
      "workspaces": ["customer-portal", "mobile"]
    },
    {
      "id": "workforce-applications",
      "name": "Workforce Applications",
      "leadHumanRole": "business-owner",
      "mandate": "Own secure workforce experiences, dynamic authorization administration and role-scoped business workflows without becoming an authorization authority.",
      "workspaces": ["workforce-portal"]
    },
    {
      "id": "identity-platform",
      "name": "Identity Platform",
      "leadHumanRole": "identity-platform-owner",
      "mandate": "Own customer and workforce authentication experience, realm separation and the deployable Keycloak theme without moving credential handling into client applications.",
      "workspaces": ["identity-theme", "design-tokens"]
    },
    {
      "id": "platform-sre",
      "name": "Platform & SRE",
      "leadHumanRole": "release-owner",
      "mandate": "Own environments, delivery, observability, recovery and production release controls.",